{
  "schemaVersion": "1.0.0",
  "taxonomyVersion": "1.0.0",
  "collection": {
    "id": 2,
    "slug": "pale-ales-bitters-et-ipa",
    "nom": "Pale Ales, Bitters et IPA"
  },
  "cartes": [
    {
      "id": "pale-ale",
      "nom": "Pale Ale",
      "collectionId": 2,
      "nature": "F",
      "parentPrincipalId": "ale",
      "aliases": [],
      "paysOrigine": [
        "Royaume-Uni",
        "International"
      ],
      "origine": {
        "libelle": "Royaume-Uni puis diffusion mondiale",
        "ville": null,
        "region": null,
        "bassinBrassicole": null
      },
      "alcool": {
        "min": null,
        "max": null,
        "unite": "%",
        "statut": "variable"
      },
      "amertume": {
        "min": null,
        "max": null,
        "unite": "IBU",
        "statut": "variable"
      },
      "couleur": {
        "min": null,
        "max": null,
        "unite": "EBC",
        "statut": "variable"
      },
      "fermentation": {
        "type": "haute",
        "details": "Fermentation haute, avec une expression de levure et une température adaptées au style."
      },
      "service": {
        "temperatureMin": null,
        "temperatureMax": null,
        "uniteTemperature": "°C",
        "verresRecommandes": [
          "Verre adapté au sous-style"
        ]
      },
      "description": "« Pale Ale » se caractérise généralement par une expression dont les traits principaux sont : ale dorée à ambrée claire, propre, portée par des houblons d’agrumes, de pin ou de fruits; le malt est net et la finale plutôt sèche. La dénomination couvre toutefois des interprétations suffisamment diverses pour que les valeurs analytiques et l’équilibre exact varient fortement.",
      "histoireEtOrigines": "La famille « Pale Ale » s’est construite progressivement autour de pratiques de fermentation, de couleur ou d’équilibre communes plutôt qu’autour d’une recette fondatrice unique. Elle rassemble aujourd’hui des traditions provenant de Royaume-Uni, International et d’autres régions. La taxonomie ZythoHunt en fait une carte autonome afin de respecter les étiquettes qui n’emploient qu’un terme générique, tout en maintenant des cartes distinctes pour les styles plus précis.",
      "recette": {
        "profilUnique": false,
        "explicationProfil": "« Pale Ale » désigne une famille regroupant plusieurs styles dont la force, la couleur, l’amertume, les ingrédients et les procédés peuvent diverger. Aucun profil de recette unique ne serait représentatif de l’ensemble de la famille.",
        "maltsEtCereales": [
          "malt pale américain",
          "faible proportion de crystal"
        ],
        "houblons": [
          "houblons américains ou du Nouveau Monde"
        ],
        "levuresEtMicroorganismes": [
          "levure ale américaine neutre"
        ],
        "ingredientsComplementaires": [],
        "profilEau": "souvent légèrement sulfatée",
        "empatage": "empâtage favorisant l’atténuation",
        "ebullitionEtHoublonnage": "amertume nette, ajouts tardifs et parfois houblonnage à cru",
        "fermentation": "fermentation haute propre",
        "maturation": "maturation courte",
        "profilRecherche": "une pale ale nette, aromatique et équilibrée vers le houblon"
      },
      "sources": [
        {
          "organisme": "Brewers Association",
          "edition": "2026",
          "reference": "Pale Ale — Beer Style Guidelines",
          "type": "guide_de_style"
        },
        {
          "organisme": "BJCP",
          "edition": "2021",
          "reference": "Pale Ale — Beer Style Guidelines",
          "type": "guide_de_style"
        },
        {
          "organisme": "World Beer Cup",
          "edition": "2026",
          "reference": "Pale Ale — Beverage Styles",
          "type": "guide_de_style"
        }
      ]
    },
    {
      "id": "bitter",
      "nom": "Bitter",
      "collectionId": 2,
      "nature": "F",
      "parentPrincipalId": "pale-ale",
      "aliases": [],
      "paysOrigine": [
        "Royaume-Uni"
      ],
      "origine": {
        "libelle": "Angleterre",
        "ville": null,
        "region": null,
        "bassinBrassicole": null
      },
      "alcool": {
        "min": null,
        "max": null,
        "unite": "%",
        "statut": "variable"
      },
      "amertume": {
        "min": null,
        "max": null,
        "unite": "IBU",
        "statut": "variable"
      },
      "couleur": {
        "min": null,
        "max": null,
        "unite": "EBC",
        "statut": "variable"
      },
      "fermentation": {
        "type": "haute",
        "details": "Fermentation haute, avec une expression de levure et une température adaptées au style."
      },
      "service": {
        "temperatureMin": null,
        "temperatureMax": null,
        "uniteTemperature": "°C",
        "verresRecommandes": [
          "Verre adapté au sous-style"
        ]
      },
      "description": "« Bitter » se caractérise généralement par une expression dont les traits principaux sont : ale cuivrée à dorée, équilibrée entre malt biscuité, esters fruités et houblon terreux ou floral; la carbonatation est souvent modérée. La dénomination couvre toutefois des interprétations suffisamment diverses pour que les valeurs analytiques et l’équilibre exact varient fortement.",
      "histoireEtOrigines": "La famille « Bitter » s’est construite progressivement autour de pratiques de fermentation, de couleur ou d’équilibre communes plutôt qu’autour d’une recette fondatrice unique. Elle rassemble aujourd’hui des traditions provenant de Royaume-Uni et d’autres régions. La taxonomie ZythoHunt en fait une carte autonome afin de respecter les étiquettes qui n’emploient qu’un terme générique, tout en maintenant des cartes distinctes pour les styles plus précis.",
      "recette": {
        "profilUnique": false,
        "explicationProfil": "« Bitter » désigne une famille regroupant plusieurs styles dont la force, la couleur, l’amertume, les ingrédients et les procédés peuvent diverger. Aucun profil de recette unique ne serait représentatif de l’ensemble de la famille.",
        "maltsEtCereales": [
          "pale ale malt britannique",
          "crystal malt avec retenue"
        ],
        "houblons": [
          "houblons britanniques"
        ],
        "levuresEtMicroorganismes": [
          "levure ale britannique expressive"
        ],
        "ingredientsComplementaires": [],
        "profilEau": "souvent minérale et sulfatée",
        "empatage": "empâtage simple autour d’un profil moyennement fermentescible",
        "ebullitionEtHoublonnage": "amertume ferme et houblon tardif modéré",
        "fermentation": "fermentation haute avec esters maîtrisés",
        "maturation": "maturation courte, service possible en cask",
        "profilRecherche": "une ale de pub sèche, équilibrée et très buvable"
      },
      "sources": [
        {
          "organisme": "Brewers Association",
          "edition": "2026",
          "reference": "Bitter — Beer Style Guidelines",
          "type": "guide_de_style"
        },
        {
          "organisme": "BJCP",
          "edition": "2021",
          "reference": "Bitter — Beer Style Guidelines",
          "type": "guide_de_style"
        },
        {
          "organisme": "World Beer Cup",
          "edition": "2026",
          "reference": "Bitter — Beverage Styles",
          "type": "guide_de_style"
        }
      ]
    },
    {
      "id": "ipa-india-pale-ale",
      "nom": "IPA / India Pale Ale",
      "collectionId": 2,
      "nature": "F",
      "parentPrincipalId": "pale-ale",
      "aliases": [
        "IPA",
        "India Pale Ale"
      ],
      "paysOrigine": [
        "Royaume-Uni",
        "International"
      ],
      "origine": {
        "libelle": "Royaume-Uni puis évolution mondiale",
        "ville": null,
        "region": null,
        "bassinBrassicole": null
      },
      "alcool": {
        "min": null,
        "max": null,
        "unite": "%",
        "statut": "variable"
      },
      "amertume": {
        "min": null,
        "max": null,
        "unite": "IBU",
        "statut": "variable"
      },
      "couleur": {
        "min": null,
        "max": null,
        "unite": "EBC",
        "statut": "variable"
      },
      "fermentation": {
        "type": "haute",
        "details": "Fermentation haute, avec une expression de levure et une température adaptées au style."
      },
      "service": {
        "temperatureMin": null,
        "temperatureMax": null,
        "uniteTemperature": "°C",
        "verresRecommandes": [
          "Verre adapté au sous-style"
        ]
      },
      "description": "« IPA / India Pale Ale » se caractérise généralement par une expression dont les traits principaux sont : houblon dominant, amertume moyenne à élevée, arômes floraux, résineux, agrumés ou fruités selon l’origine; le malt sert d’appui et la finale reste sèche. La dénomination couvre toutefois des interprétations suffisamment diverses pour que les valeurs analytiques et l’équilibre exact varient fortement.",
      "histoireEtOrigines": "La famille « IPA / India Pale Ale » s’est construite progressivement autour de pratiques de fermentation, de couleur ou d’équilibre communes plutôt qu’autour d’une recette fondatrice unique. Elle rassemble aujourd’hui des traditions provenant de Royaume-Uni, International et d’autres régions. La taxonomie ZythoHunt en fait une carte autonome afin de respecter les étiquettes qui n’emploient qu’un terme générique, tout en maintenant des cartes distinctes pour les styles plus précis.",
      "recette": {
        "profilUnique": false,
        "explicationProfil": "« IPA / India Pale Ale » désigne une famille regroupant plusieurs styles dont la force, la couleur, l’amertume, les ingrédients et les procédés peuvent diverger. Aucun profil de recette unique ne serait représentatif de l’ensemble de la famille.",